{
  "issuer_id": "global-ai-governance.test-issuer",
  "kid": "urn:ietf:params:oauth:jwk-thumbprint:sha-256:1IG2tMH7J2wbJZnOf8LJzQitKf7LMvoAElsuDMVM54Y",
  "jwk": {
    "kty": "OKP",
    "crv": "Ed25519",
    "x": "A6EHv_POEL4dcN0Y50vAmWfk1jCbpQ1fHdyGZBJVMbg",
    "alg": "Ed25519",
    "use": "sig",
    "key_ops": [
      "verify"
    ]
  },
  "not_before": "2026-01-01T00:00:00Z",
  "expires_at": "2027-01-01T00:00:00Z",
  "status": "ACTIVE",
  "allowed_algorithms": [
    "Ed25519"
  ]
}
